mysql> select * from address_book;
+------------+------------+---------------------+--------+--------+--------------+----------------+
| First_Name | Last_Name  | Address             | City   | zip    | Phone_number | Email          |
+------------+------------+---------------------+--------+--------+--------------+----------------+
| Darshan    | Mhatre     | AT-Lokmanya Society | Mumbai | 402312 |      7276985 | darsh@gmil.com |
| Yukta      | Bapardekar | AT-Sagar Society    | panvel | 401232 |     72775785 | yukta@gmil.com |
| joy        | Funny      | AT-cherry Society   | UK     | 501232 |    726564785 | joy@gmil.com   |
| Han        | Cunny      | AT-Apple Society    | USA    | 671232 |    544656478 | han@gmil.com   |
+------------+------------+---------------------+--------+--------+--------------+----------------+
4 rows in set (0.00 sec)

mysql> delete from address_book where First_Name = 'han';
Query OK, 1 row affected (0.19 sec)

mysql> select * from address_book;
+------------+------------+---------------------+--------+--------+--------------+----------------+
| First_Name | Last_Name  | Address             | City   | zip    | Phone_number | Email          |
+------------+------------+---------------------+--------+--------+--------------+----------------+
| Darshan    | Mhatre     | AT-Lokmanya Society | Mumbai | 402312 |      7276985 | darsh@gmil.com |
| Yukta      | Bapardekar | AT-Sagar Society    | panvel | 401232 |     72775785 | yukta@gmil.com |
| joy        | Funny      | AT-cherry Society   | UK     | 501232 |    726564785 | joy@gmil.com   |
+------------+------------+---------------------+--------+--------+--------------+----------------+
3 rows in set (0.00 sec)